"Status","Start Time","Stop Time","Duration in ms","Parent Suite","Suite","Sub Suite","Test Class","Test Method","Name","Description"
"passed","Wed Sep 25 02:03:57 GMT 2024","Wed Sep 25 02:03:58 GMT 2024","1076","tests.api","test_api","TestEntityAPI","","","Test delete entity","Verify that an entity can be deleted successfully"
"passed","Wed Sep 25 02:03:55 GMT 2024","Wed Sep 25 02:03:55 GMT 2024","361","tests.api","test_api","TestEntityAPI","","","Test get entity","Verify that a specific entity can be retrieved"
"passed","Wed Sep 25 02:03:56 GMT 2024","Wed Sep 25 02:03:57 GMT 2024","719","tests.api","test_api","TestEntityAPI","","","Test update entity","Verify that an entity can be updated successfully"
"passed","Wed Sep 25 02:03:54 GMT 2024","Wed Sep 25 02:03:54 GMT 2024","0","tests.api","test_api","TestEntityAPI","","","Test create entity","Verify that an entity can be created successfully"
"passed","Wed Sep 25 02:03:55 GMT 2024","Wed Sep 25 02:03:56 GMT 2024","354","tests.api","test_api","TestEntityAPI","","","Test get all entities","Verify that all entities can be retrieved"
